{
  "incident_id": "INC-2026-0825-002",
  "title": "午高峰前隐性配置漂移导致订单服务容量不足",
  "ground_truth": {
    "case_type": "golden",
    "model_support": "supported",
    "expected_outcome": "diagnose",
    "expected_primary_causes": ["H-POOL"],
    "expected_amplifiers": ["H-DEPENDENCY"],
    "expected_not_causal": ["H-CODE"],
    "fixture_scope": "pipeline-and-evaluation",
    "known_actual_causes": ["H-POOL"],
    "rationale": "配置漂移后的连接池容量低于需求；恢复容量可消除基线失败，依赖回退只部分缓解。",
    "boundary_note": "合成配置容量回放；不等同于真实配置中心漂移检测准确率。"
  },
  "baseline": {
    "traffic_rps": 110.0,
    "pool_size": 7,
    "dependency_latency_factor": 1.25,
    "code_version": "b72d4a",
    "adaptive_min_pool": false
  },
  "events": [
    {
      "timestamp": "2026-08-25T09:20:00+08:00",
      "kind": "commit",
      "source": "git:b72d4a",
      "summary": "整理订单服务指标上报字段",
      "details": {"files": ["checkout/metrics.py"], "author": "demo"}
    },
    {
      "timestamp": "2026-08-25T09:42:00+08:00",
      "kind": "dependency",
      "source": "lockfile:payment-client@2.1",
      "summary": "支付客户端升级后平均请求占用时间小幅增加",
      "details": {"from": "2.0", "to": "2.1", "latency_factor": 1.25}
    },
    {
      "timestamp": "2026-08-25T10:02:00+08:00",
      "kind": "configuration",
      "source": "config:db.pool.maxSize",
      "summary": "灰度配置误把连接池从 20 调整为 7",
      "details": {"from": 20, "to": 7, "change_ticket": "CHG-9017"}
    },
    {
      "timestamp": "2026-08-25T10:10:00+08:00",
      "kind": "traffic",
      "source": "metric:checkout.rps",
      "summary": "午高峰前流量升至 110 RPS",
      "details": {"previous_rps": 58, "current_rps": 110}
    },
    {
      "timestamp": "2026-08-25T10:12:00+08:00",
      "kind": "incident",
      "source": "alert:checkout-capacity",
      "summary": "订单创建失败率升高并出现连接等待",
      "details": {"route": "/api/order/create", "severity": "SEV-2"}
    }
  ],
  "hypotheses": [
    {
      "id": "H-CODE",
      "title": "指标上报字段整理引入性能回退",
      "owner": "hypothesis-scientist-code",
      "intervention": {"code_version": "pre-b72d4a"},
      "rationale": "代码提交位于事故窗口，需要先证伪。"
    },
    {
      "id": "H-DEPENDENCY",
      "title": "支付客户端升级放大请求占用时间",
      "owner": "hypothesis-scientist-dependency",
      "intervention": {"dependency_latency_factor": 1.0},
      "rationale": "依赖升级可能放大连接占用，但不足以解释全部失败。"
    },
    {
      "id": "H-POOL",
      "title": "隐性连接池配置漂移造成容量不足",
      "owner": "hypothesis-scientist-config",
      "intervention": {"pool_size": 20},
      "rationale": "连接池容量被错误下调，可能低于高峰需求。"
    }
  ],
  "mutations": [
    {"name": "nominal-drift", "changes": {"traffic_rps": 110.0, "dependency_latency_factor": 1.25}},
    {"name": "pre-peak-traffic", "changes": {"traffic_rps": 132.0, "dependency_latency_factor": 1.25}},
    {"name": "slow-payment", "changes": {"traffic_rps": 110.0, "dependency_latency_factor": 1.55}},
    {"name": "drift-with-burst", "changes": {"traffic_rps": 132.0, "dependency_latency_factor": 1.55}}
  ],
  "patch_candidates": [
    {
      "id": "P-ROLLBACK-CODE",
      "title": "回滚指标上报字段整理",
      "changes": {"code_version": "pre-b72d4a"},
      "rollback_changes": {"code_version": "b72d4a"},
      "risk": 0.12,
      "cost": 0.18,
      "rollback": "重新部署 b72d4a"
    },
    {
      "id": "P-PIN-DEPENDENCY",
      "title": "将支付客户端回退至 2.0",
      "changes": {"dependency_latency_factor": 1.0},
      "rollback_changes": {"dependency_latency_factor": 1.25},
      "risk": 0.28,
      "cost": 0.32,
      "rollback": "恢复 payment-client 2.1 锁文件"
    },
    {
      "id": "P-RESTORE-POOL",
      "title": "恢复连接池 24 并增加配置漂移检测",
      "changes": {"pool_size": 24},
      "rollback_changes": {"pool_size": 7},
      "risk": 0.30,
      "cost": 0.15,
      "rollback": "恢复 db.pool.maxSize=7 配置快照"
    },
    {
      "id": "P-ADAPTIVE-GUARD",
      "title": "启用自适应连接池下限保护",
      "changes": {"pool_size": 24, "adaptive_min_pool": true},
      "rollback_changes": {"pool_size": 7, "adaptive_min_pool": false},
      "risk": 0.55,
      "cost": 0.45,
      "rollback": "关闭 adaptive_min_pool 并恢复配置快照"
    }
  ]
}
