{
  "incident_id": "INC-2026-0816-001",
  "title": "订单创建接口在午间流量下出现高失败率与长尾延迟",
  "ground_truth": {
    "case_type": "golden",
    "model_support": "supported",
    "expected_outcome": "diagnose",
    "expected_primary_causes": ["H-POOL"],
    "expected_amplifiers": ["H-DEPENDENCY"],
    "expected_not_causal": ["H-CODE"],
    "fixture_scope": "pipeline-and-evaluation",
    "known_actual_causes": ["H-POOL"],
    "rationale": "在当前确定性容量模型中，恢复连接池可消除主要失败，回退依赖只能部分缓解。",
    "boundary_note": "合成容量回放；只验证 pool_size 与 dependency_latency_factor，不证明真实生产根因。"
  },
  "baseline": {
    "traffic_rps": 120.0,
    "pool_size": 8,
    "dependency_latency_factor": 1.3,
    "code_version": "a91c7e",
    "adaptive_min_pool": false
  },
  "events": [
    {
      "timestamp": "2026-08-06T09:40:00+08:00",
      "kind": "commit",
      "source": "git:a91c7e",
      "summary": "为订单请求增加关联日志",
      "details": {"files": ["checkout/logging.py"], "author": "demo"}
    },
    {
      "timestamp": "2026-08-06T09:55:00+08:00",
      "kind": "dependency",
      "source": "lockfile:payment-client@2.0",
      "summary": "支付客户端升级，重试路径平均延迟增加",
      "details": {"from": "1.8", "to": "2.0", "latency_factor": 1.3}
    },
    {
      "timestamp": "2026-08-06T10:10:00+08:00",
      "kind": "configuration",
      "source": "config:db.pool.maxSize",
      "summary": "数据库连接池从 24 调整为 8",
      "details": {"from": 24, "to": 8, "change_ticket": "CHG-8842"}
    },
    {
      "timestamp": "2026-08-06T10:15:00+08:00",
      "kind": "traffic",
      "source": "metric:checkout.rps",
      "summary": "午间活动流量升至 120 RPS",
      "details": {"previous_rps": 62, "current_rps": 120}
    },
    {
      "timestamp": "2026-08-06T10:16:00+08:00",
      "kind": "incident",
      "source": "alert:checkout-5xx",
      "summary": "订单创建失败率和 P99 延迟同时升高",
      "details": {"route": "/api/order/create", "severity": "SEV-2"}
    }
  ],
  "hypotheses": [
    {
      "id": "H-CODE",
      "title": "关联日志代码变更导致性能回退",
      "owner": "hypothesis-scientist-code",
      "intervention": {"code_version": "pre-a91c7e"},
      "rationale": "代码提交距离故障最近，需要通过撤销提交证伪。"
    },
    {
      "id": "H-DEPENDENCY",
      "title": "支付客户端升级放大请求占用时间",
      "owner": "hypothesis-scientist-dependency",
      "intervention": {"dependency_latency_factor": 1.0},
      "rationale": "依赖升级增加重试延迟，可能降低连接复用能力。"
    },
    {
      "id": "H-POOL",
      "title": "连接池缩容造成服务容量不足",
      "owner": "hypothesis-scientist-config",
      "intervention": {"pool_size": 24},
      "rationale": "连接池在流量上涨前被缩减三分之二，容量可能低于需求。"
    }
  ],
  "mutations": [
    {"name": "nominal", "changes": {"traffic_rps": 120.0, "dependency_latency_factor": 1.3}},
    {"name": "high-traffic", "changes": {"traffic_rps": 160.0, "dependency_latency_factor": 1.3}},
    {"name": "slow-downstream", "changes": {"traffic_rps": 120.0, "dependency_latency_factor": 1.6}},
    {"name": "combined-stress", "changes": {"traffic_rps": 160.0, "dependency_latency_factor": 1.6}}
  ],
  "patch_candidates": [
    {
      "id": "P-ROLLBACK-CODE",
      "title": "回滚关联日志提交",
      "changes": {"code_version": "pre-a91c7e"},
      "rollback_changes": {"code_version": "a91c7e"},
      "risk": 0.15,
      "cost": 0.20,
      "rollback": "重新部署 a91c7e"
    },
    {
      "id": "P-PIN-DEPENDENCY",
      "title": "将支付客户端回退至 1.8",
      "changes": {"dependency_latency_factor": 1.0},
      "rollback_changes": {"dependency_latency_factor": 1.3},
      "risk": 0.30,
      "cost": 0.35,
      "rollback": "恢复 payment-client 2.0 锁文件"
    },
    {
      "id": "P-RESTORE-POOL",
      "title": "恢复连接池 24 并增加容量验证门禁",
      "changes": {"pool_size": 24},
      "rollback_changes": {"pool_size": 8},
      "risk": 0.30,
      "cost": 0.15,
      "rollback": "恢复 db.pool.maxSize=8 配置快照"
    },
    {
      "id": "P-ADAPTIVE-GUARD",
      "title": "启用自适应连接池下限保护",
      "changes": {"pool_size": 24, "adaptive_min_pool": true},
      "rollback_changes": {"pool_size": 8, "adaptive_min_pool": false},
      "risk": 0.55,
      "cost": 0.45,
      "rollback": "关闭 adaptive_min_pool 并恢复配置快照"
    }
  ]
}
