{
  "incident_id": "INC-2026-0821-CODE",
  "title": "序列化代码回归导致订单服务单请求占用翻倍",
  "ground_truth": {
    "case_type": "golden",
    "model_support": "supported",
    "expected_outcome": "diagnose",
    "expected_primary_causes": ["H-CODE"],
    "expected_amplifiers": ["H-DEPENDENCY", "H-POOL"],
    "expected_not_causal": [],
    "fixture_scope": "pipeline-and-evaluation",
    "known_actual_causes": ["H-CODE"],
    "rationale": "代码延迟因子升至2.4；回滚代码性能因子后故障消失，轻微依赖优化或扩容只能缓解。",
    "boundary_note": "模型要求显式提供code_latency_factor，不会从版本字符串猜测性能。"
  },
  "baseline": {
    "traffic_rps": 100.0,
    "pool_size": 20,
    "dependency_latency_factor": 1.0,
    "code_version": "serializer-v4",
    "adaptive_min_pool": false,
    "code_latency_factor": 2.4
  },
  "events": [
    {
      "timestamp": "2026-08-21T14:00:00+08:00",
      "kind": "commit",
      "source": "git:serializer-v4",
      "summary": "订单序列化器切换为深度反射实现",
      "details": {"files": ["checkout/serializer.py"], "latency_factor": 2.4}
    },
    {
      "timestamp": "2026-08-21T14:04:00+08:00",
      "kind": "dependency",
      "source": "lockfile:payment-client@3.1",
      "summary": "依赖版本保持不变",
      "details": {"latency_factor": 1.0}
    },
    {
      "timestamp": "2026-08-21T14:08:00+08:00",
      "kind": "incident",
      "source": "alert:checkout-code-latency",
      "summary": "发布后失败率和P99上升",
      "details": {"severity": "SEV-2"}
    }
  ],
  "hypotheses": [
    {
      "id": "H-CODE",
      "title": "序列化代码回归是主因",
      "owner": "hypothesis-scientist",
      "intervention": {"code_version": "serializer-v3", "code_latency_factor": 1.0},
      "rationale": "撤销代码及其显式性能因子。"
    },
    {
      "id": "H-DEPENDENCY",
      "title": "依赖延迟轻微优化可以缓解",
      "owner": "hypothesis-scientist",
      "intervention": {"dependency_latency_factor": 0.9},
      "rationale": "验证下游优化是否只是放大项。"
    },
    {
      "id": "H-POOL",
      "title": "连接池余量偏低放大代码回归",
      "owner": "hypothesis-scientist",
      "intervention": {"pool_size": 22},
      "rationale": "小幅扩容应只能缓解而非完全消除。"
    }
  ],
  "mutations": [
    {"name": "nominal", "changes": {"traffic_rps": 100.0, "code_latency_factor": 2.4}},
    {"name": "traffic-115", "changes": {"traffic_rps": 115.0, "code_latency_factor": 2.4}},
    {"name": "dependency-jitter", "changes": {"traffic_rps": 100.0, "dependency_latency_factor": 1.3, "code_latency_factor": 2.4}},
    {"name": "pool-drift", "changes": {"traffic_rps": 100.0, "pool_size": 18, "code_latency_factor": 2.4}}
  ],
  "patch_candidates": [
    {
      "id": "P-ROLLBACK-CODE",
      "title": "回滚序列化器并增加性能预算门禁",
      "changes": {"code_version": "serializer-v3", "code_latency_factor": 1.0},
      "risk": 0.25,
      "cost": 0.15,
      "rollback": "恢复 serializer-v4 与 code_latency_factor=2.4 快照",
      "rollback_changes": {"code_version": "serializer-v4", "code_latency_factor": 2.4}
    },
    {
      "id": "P-SCALE-POOL",
      "title": "连接池扩至32掩盖代码延迟",
      "changes": {"pool_size": 32},
      "risk": 0.5,
      "cost": 0.45,
      "rollback": "恢复 pool_size=20 快照",
      "rollback_changes": {"pool_size": 20}
    },
    {
      "id": "P-TUNE-DEPENDENCY",
      "title": "优化下游调用超时",
      "changes": {"dependency_latency_factor": 0.8},
      "risk": 0.35,
      "cost": 0.35,
      "rollback": "恢复 dependency_latency_factor=1.0",
      "rollback_changes": {"dependency_latency_factor": 1.0}
    }
  ]
}
