{
  "incident_id": "INC-2026-0825-007",
  "title": "API timeout 策略放大连接池缩容故障",
  "ground_truth": {
    "case_type": "golden",
    "model_support": "supported",
    "expected_outcome": "diagnose",
    "expected_primary_causes": ["H-POOL"],
    "expected_amplifiers": ["H-DEPENDENCY"],
    "expected_not_causal": ["H-CODE"],
    "fixture_scope": "pipeline-and-evaluation",
    "known_actual_causes": ["H-POOL"],
    "rationale": "当前容量方程中恢复连接池可消除基线失败，timeout 依赖延迟是放大因素。",
    "boundary_note": "合成容量回放；不包含真实网关 timeout 栈和端到端请求。"
  },
  "baseline": {
    "traffic_rps": 150.0,
    "pool_size": 12,
    "dependency_latency_factor": 1.5,
    "code_version": "a77e31",
    "adaptive_min_pool": false
  },
  "events": [
    {"timestamp": "2026-08-25T16:05:00+08:00", "kind": "commit", "source": "git:a77e31", "summary": "订单 API 增加 timeout 标签与监控字段", "details": {"files": ["checkout/api.py"], "author": "demo"}},
    {"timestamp": "2026-08-25T16:12:00+08:00", "kind": "dependency", "source": "lockfile:gateway-client@6.0", "summary": "网关客户端 timeout 策略使长尾请求占用时间增加", "details": {"from": "5.8", "to": "6.0", "latency_factor": 1.5}},
    {"timestamp": "2026-08-25T16:18:00+08:00", "kind": "configuration", "source": "config:db.pool.maxSize", "summary": "连接池从 24 下调到 12", "details": {"from": 24, "to": 12, "change_ticket": "CHG-9102"}},
    {"timestamp": "2026-08-25T16:26:00+08:00", "kind": "traffic", "source": "metric:checkout.rps", "summary": "晚高峰流量升至 150 RPS", "details": {"previous_rps": 80, "current_rps": 150}},
    {"timestamp": "2026-08-25T16:27:00+08:00", "kind": "incident", "source": "alert:api-timeout-tail", "summary": "订单 API timeout 与失败率同时升高", "details": {"route": "/api/order/create", "severity": "SEV-2"}}
  ],
  "hypotheses": [
    {"id": "H-CODE", "title": "timeout 监控字段导致性能回退", "owner": "hypothesis-scientist-code", "intervention": {"code_version": "pre-a77e31"}, "rationale": "代码变更需要证伪。"},
    {"id": "H-DEPENDENCY", "title": "网关客户端 timeout 策略放大请求占用时间", "owner": "hypothesis-scientist-dependency", "intervention": {"dependency_latency_factor": 1.0}, "rationale": "timeout 策略会缓解但不一定完全修复容量问题。"},
    {"id": "H-POOL", "title": "连接池缩容导致 timeout 策略下容量不足", "owner": "hypothesis-scientist-config", "intervention": {"pool_size": 24}, "rationale": "连接池下调与 timeout 长尾共同导致失败率升高。"}
  ],
  "mutations": [
    {"name": "nominal-timeout", "changes": {"traffic_rps": 150.0, "dependency_latency_factor": 1.5}},
    {"name": "peak-timeout", "changes": {"traffic_rps": 172.0, "dependency_latency_factor": 1.5}},
    {"name": "tail-timeout", "changes": {"traffic_rps": 150.0, "dependency_latency_factor": 1.75}},
    {"name": "peak-tail-timeout", "changes": {"traffic_rps": 172.0, "dependency_latency_factor": 1.75}}
  ],
  "patch_candidates": [
    {"id": "P-ROLLBACK-CODE", "title": "回滚 timeout 监控字段", "changes": {"code_version": "pre-a77e31"}, "rollback_changes": {"code_version": "a77e31"}, "risk": 0.12, "cost": 0.18, "rollback": "重新部署 a77e31"},
    {"id": "P-PIN-DEPENDENCY", "title": "将网关客户端回退至 5.8", "changes": {"dependency_latency_factor": 1.0}, "rollback_changes": {"dependency_latency_factor": 1.5}, "risk": 0.30, "cost": 0.35, "rollback": "恢复 gateway-client 6.0 锁文件"},
    {"id": "P-RESTORE-POOL", "title": "恢复连接池 24 并增加 timeout 长尾容量验证", "changes": {"pool_size": 24}, "rollback_changes": {"pool_size": 12}, "risk": 0.30, "cost": 0.15, "rollback": "恢复 db.pool.maxSize=12 配置快照"},
    {"id": "P-ADAPTIVE-GUARD", "title": "启用自适应连接池下限保护", "changes": {"pool_size": 24, "adaptive_min_pool": true}, "rollback_changes": {"pool_size": 12, "adaptive_min_pool": false}, "risk": 0.55, "cost": 0.45, "rollback": "关闭 adaptive_min_pool 并恢复配置快照"}
  ]
}
