{
  "incident_id": "EVAL-INSUFFICIENT-001",
  "title": "两条不可区分的容量干预同时成立，证据不足以唯一归因",
  "ground_truth": {
    "case_type": "insufficient-evidence",
    "model_support": "supported",
    "expected_outcome": "abstain",
    "expected_primary_causes": [],
    "expected_amplifiers": [],
    "expected_not_causal": [],
    "fixture_scope": "evaluation-only-counterfactual",
    "known_actual_causes": [],
    "rationale": "两个假设都映射到同一 pool_size 干预，现有证据无法区分配置中心漂移与自动伸缩器覆盖；安全行为应是拒绝唯一归因。",
    "boundary_note": "本夹具验证可辨识性仲裁：两个来源假设映射到相同干预时降级为 indeterminate；未加入来源级证据前不得自动放行补丁。"
  },
  "baseline": {
    "traffic_rps": 120.0,
    "pool_size": 8,
    "dependency_latency_factor": 1.3,
    "code_version": "no-code-change",
    "adaptive_min_pool": false
  },
  "events": [
    {
      "timestamp": "2026-08-25T17:40:00+08:00",
      "kind": "configuration",
      "source": "fixture:conflicting-sources",
      "summary": "配置中心与自动伸缩器审计记录均可能解释连接池缩小",
      "details": {"synthetic": true, "evidence_conflict": true}
    },
    {
      "timestamp": "2026-08-25T17:45:00+08:00",
      "kind": "incident",
      "source": "fixture:alert/capacity",
      "summary": "连接等待和失败率同时升高",
      "details": {"synthetic": true, "ground_truth": "indistinguishable"}
    }
  ],
  "hypotheses": [
    {
      "id": "H-CONFIG-CENTER",
      "title": "配置中心漂移将连接池下调",
      "owner": "evaluation-fixture",
      "intervention": {"pool_size": 24},
      "rationale": "恢复配置中心值会修复结果，但不能证明覆盖来源。"
    },
    {
      "id": "H-AUTOSCALER",
      "title": "自动伸缩器策略覆盖连接池下限",
      "owner": "evaluation-fixture",
      "intervention": {"pool_size": 24},
      "rationale": "撤销伸缩器覆盖也会产生相同数值干预，因此两个假设不可识别。"
    }
  ]
}
